<?xml version="1.0" encoding="ISO-8859-1"?>
<ReturnSubmission xmlns:xsi="http://www.w3.org/2001/XMLSchema-instance" xsi:noNamespaceSchemaLocation="AlbertaCorporateIncomeTaxReturn.xsd">
  <Return>
    <ProgramCode>01</ProgramCode>
  <Schedule Number="000">
    <Value LineItemID="000001001">1</Value>
    <Value LineItemID="000005001">HL2026</Value>
    <Value LineItemID="000010001">Cascade Research Corp.</Value>
    <Value LineItemID="000012001">888 3 Street SW</Value>
    <Value LineItemID="000014001">Calgary</Value>
    <Value LineItemID="000015001">AB</Value>
    <Value LineItemID="000017001">T2P 5C5</Value>
    <Value LineItemID="000025001">Marcus Reyes</Value>
    <Value LineItemID="000026001">4035550164</Value>
    <Value LineItemID="000028001">5417</Value>
    <Value LineItemID="000029001">1</Value>
    <Value LineItemID="000031001">2</Value>
    <Value LineItemID="000032001">2</Value>
    <Value LineItemID="000034001">424102978</Value>
    <Value LineItemID="000035001">926318475RC0001</Value>
    <Value LineItemID="000036001">20250101</Value>
    <Value LineItemID="000037001">20251231</Value>
    <Value LineItemID="000038001">2</Value>
    <Value LineItemID="000047001">1500000</Value>
    <Value LineItemID="000048001">1400000</Value>
    <Value LineItemID="000050001">2</Value>
    <Value LineItemID="000054001">2</Value>
    <Value LineItemID="000060001">2</Value>
    <Value LineItemID="000061001">2</Value>
    <Value LineItemID="000062001">0</Value>
    <Value LineItemID="000064001">0</Value>
    <Value LineItemID="000065001">1.000000</Value>
    <Value LineItemID="000068001">0</Value>
    <Value LineItemID="000070001">0</Value>
    <Value LineItemID="000071001">0</Value>
    <Value LineItemID="000072001">0</Value>
    <Value LineItemID="000074001">0</Value>
    <Value LineItemID="000076001">0</Value>
    <Value LineItemID="000080001">0</Value>
    <Value LineItemID="000081001">0</Value>
    <Value LineItemID="000082001">0</Value>
    <Value LineItemID="000085001">0</Value>
    <Value LineItemID="000086001">0</Value>
    <Value LineItemID="000087001">0</Value>
    <Value LineItemID="000090001">0</Value>
    <Value LineItemID="000091001">0</Value>
    <Value LineItemID="000095001">1</Value>
    <Value LineItemID="000115001">0</Value>
    <Value LineItemID="000129001">89250</Value>
    <Value LineItemID="000097001">Marcus</Value>
    <Value LineItemID="000098001">Reyes</Value>
    <Value LineItemID="000099001">Chief Financial Officer</Value>
    <Value LineItemID="000101001">20260829</Value>
    <Value LineItemID="000103001">4035550164</Value>
    <Value LineItemID="000105001">marcus.reyes@cascaderesearch.test</Value>
  </Schedule>
  <Schedule Number="001">
    <Value LineItemID="001003001">0</Value>
    <Value LineItemID="001007001">0</Value>
    <Value LineItemID="001009001">0</Value>
    <Value LineItemID="001013001">0</Value>
  </Schedule>
  <Schedule Number="029">
    <Value LineItemID="029003001">1500000</Value>
    <Value LineItemID="029005001">1000000</Value>
    <Value LineItemID="029031001">1000000</Value>
    <Value LineItemID="029040001">2</Value>
    <Value LineItemID="029110001">80000</Value>
    <Value LineItemID="029125001">39000</Value>
    <Value LineItemID="029126001">20000000</Value>
    <Value LineItemID="029128001">0.750000</Value>
    <Value LineItemID="029130001">89250</Value>
    <Value LineItemID="029134001">89250</Value>
    <Value LineItemID="029200001">700200300</Value>
    <Value LineItemID="029202001">2024-07-01</Value>
    <Value LineItemID="029204001">2025-06-30</Value>
    <Value LineItemID="029206001">365</Value>
    <Value LineItemID="029208001">4000000</Value>
    <Value LineItemID="029230001">424102978</Value>
    <Value LineItemID="029235001">2025-12-31</Value>
    <Value LineItemID="029240001">3000000</Value>
    <Value LineItemID="029245001">1000000</Value>
    <Value LineItemID="029250001">750000</Value>
    <Value LineItemID="029260001">600000</Value>
    <Value LineItemID="029265001">10000000</Value>
    <Value LineItemID="029267001">325000</Value>
    <Value LineItemID="029268001">325000</Value>
    <Value LineItemID="029230002">700200300</Value>
    <Value LineItemID="029235002">2025-06-30</Value>
    <Value LineItemID="029240002">1000000</Value>
    <Value LineItemID="029245002">200000</Value>
    <Value LineItemID="029250002">0</Value>
    <Value LineItemID="029260002">500000</Value>
    <Value LineItemID="029265002">3000000</Value>
    <Value LineItemID="029267002">-50000</Value>
    <Value LineItemID="029268002">0</Value>
    <Value LineItemID="029230003">700300400</Value>
    <Value LineItemID="029235003">2025-09-30</Value>
    <Value LineItemID="029240003">0</Value>
    <Value LineItemID="029245003">100000</Value>
    <Value LineItemID="029250003">80000</Value>
    <Value LineItemID="029260003">0</Value>
    <Value LineItemID="029265003">5000000</Value>
    <Value LineItemID="029267003">60000</Value>
    <Value LineItemID="029268003">0</Value>
    <Value LineItemID="029230004">700400500</Value>
    <Value LineItemID="029235004">2025-03-31</Value>
    <Value LineItemID="029240004">0</Value>
    <Value LineItemID="029245004">0</Value>
    <Value LineItemID="029250004">0</Value>
    <Value LineItemID="029260004">0</Value>
    <Value LineItemID="029265004">2000000</Value>
    <Value LineItemID="029267004">0</Value>
    <Value LineItemID="029268004">0</Value>
    <Value LineItemID="029270001">4000000</Value>
    <Value LineItemID="029275001">1300000</Value>
    <Value LineItemID="029280001">830000</Value>
    <Value LineItemID="029290001">1100000</Value>
    <Value LineItemID="029300001">20000000</Value>
    <Value LineItemID="029310001">335000</Value>
    <Value LineItemID="029320001">325000</Value>
    <Value LineItemID="029325001">325000</Value>
  </Schedule>
  <Schedule Number="4970">
    <Value LineItemID="4970101001">Next-generation materials research programme</Value>
    <Value LineItemID="4970103001">2.04.01</Value>
    <Value LineItemID="4970105001">1000000</Value>
    <Value LineItemID="4970107001">500000</Value>
    <Value LineItemID="4970109001">400000</Value>
    <Value LineItemID="4970105002">1000000</Value>
    <Value LineItemID="4970107002">500000</Value>
    <Value LineItemID="4970109002">400000</Value>
    <Value LineItemID="4970111002">0</Value>
    <Value LineItemID="4970113002">0</Value>
    <Value LineItemID="4970135001">1000000</Value>
    <Value LineItemID="4970137001">500000</Value>
    <Value LineItemID="4970170001">1500000</Value>
  </Schedule>
  <Schedule Number="EDI">
    <Value LineItemID="EDI001001">HL2026</Value>
    <Value LineItemID="EDI011001">0.0.1</Value>
    <Value LineItemID="EDI013001">0.1.0</Value>
    <Value LineItemID="EDI015001">SR_DEV</Value>
    <Value LineItemID="EDI017001">1</Value>
    <Value LineItemID="EDI019001">TaxFoundry Inc.</Value>
    <Value LineItemID="EDI031001">TaxFoundry</Value>
    <Value LineItemID="EDI033001">Support</Value>
    <Value LineItemID="EDI035001">Transmitter</Value>
    <Value LineItemID="EDI037001">0000000000</Value>
    <Value LineItemID="EDI041001">filing@taxfoundry.ca</Value>
  </Schedule>
  </Return>
</ReturnSubmission>
